{
  "schema_version": 1,
  "asset": "idle-body-04.png",
  "sha256": "b164bbdac7bd66d5e378eedb6768d70cda9f684b632d7958d414c2ca0968177c",
  "kind": "image",
  "origin": "derived",
  "created_at": "2026-09-30T06:37:25+00:00",
  "generator": {
    "tool": "assets/bakeoff/protagonist/glow-up/trial-b/idle_hybrid.py",
    "tool_version": "idle_hybrid.py round 8: idle frame 4/8 (t=0.500s of a 1.0s loop). Holds idle-body-00.round-07.png (the neutral-rest pose) as the single source painting and applies a piecewise vertical breathing stretch above a fixed waist line (WAIST_Y_FRAC=0.36 of body height; everything at/below the waist, including both feet and the hem, is an exact identity copy) by factor s=1.02000 (breath(t)=(1-cos(2*pi*t))/2, peak amplitude 2%), so the chest/shoulders/hood/head lift slightly while sole_y stays bit-identical across all 8 frames -- fixes round 7's kept gap 1 ('boiling': round-07/critic.md).",
    "model": null,
    "params": {},
    "inputs": [
      {
        "path": "assets/bakeoff/protagonist/glow-up/trial-b/frames/idle-body-00.round-07.png",
        "sha256": "135c86bc1999684e242b4737628526f493868c80dae2d8332a7b7fd81742c7c8"
      }
    ]
  },
  "human_edits": [],
  "license": "proprietary"
}
