{
  "schema_version": 1,
  "asset": "fall-scarf-04.round-05.png",
  "sha256": "c8b56684ce9954ab33abae5307cb993180e78af92deb31b06b703e395b919ae7",
  "kind": "image",
  "origin": "derived",
  "created_at": "2026-09-30T04:34:24+00:00",
  "generator": {
    "tool": "assets/bakeoff/protagonist/glow-up/trial-b/grade_b.py",
    "tool_version": "grade_b.py round 5: darkens body value (scale(V)=1-BODY_K*(1-V/255), BODY_K=0.56, protecting near-white highlights/skin/face) with a soft warm rim a few px inside the alpha edge, and solidifies scarf alpha (morphological close + narrow Gaussian edge, SCARF_EDGE_PX=7) so only ~1-2 final px stay soft -- reads the frozen round-04.png copy",
    "model": null,
    "params": {},
    "inputs": [
      {
        "path": "assets/bakeoff/protagonist/glow-up/trial-b/frames/fall-scarf-04.round-04.png",
        "sha256": "7d2626c89959e524b1ef20082bea4c7d8cf4fb7ca08207a1d64817a98fae8057"
      }
    ]
  },
  "human_edits": [
    {
      "by": "VioletRound6 (Claude)",
      "description": "Frozen as fall-scarf-04.round-05.png for round 5's own shot provenance (identical bytes to the live fall-scarf-04.png through round 5, same generator metadata as the live file's own round-5 record since it's the same pixels/bytes, just parked at a path nothing will touch again) before glow-up round 6 overwrote the live fall-scarf-04.png with a repaint; see assets/bakeoff/protagonist/glow-up/rounds.md's 'Frozen inputs' convention.",
      "at": "2026-09-30T04:34:33+00:00"
    }
  ],
  "license": "proprietary"
}
