{
  "schema_version": 1,
  "asset": "land-finalize-record.json",
  "sha256": "015c54aa1a94c1473060f38b0f445b0471bb94b15feb9b8fb088ecfd5f0c362b",
  "kind": "animation",
  "origin": "derived",
  "created_at": "2026-10-01T03:53:50+00:00",
  "generator": {
    "tool": "trial-b/finalize_anim.py",
    "tool_version": "land --mode grounded --nframes 3 (commit 9344647)",
    "model": null,
    "params": {},
    "inputs": [
      {
        "path": "assets/bakeoff/protagonist/glow-up/trial-b/frames/land-body-00.png",
        "sha256": "4fc774ca366836b52af4a9813da8cdb2295c2cad6b1af89e1652210fe553b479"
      },
      {
        "path": "assets/bakeoff/protagonist/glow-up/trial-b/frames/land-body-01.png",
        "sha256": "a3ff23d233c92c171343dbb9ad230fff0bd09ad6cb112d45e804f4e80f764934"
      },
      {
        "path": "assets/bakeoff/protagonist/glow-up/trial-b/frames/land-body-02.png",
        "sha256": "57ae0bee6812c2d8bae4b0e16c319b959988ccb043af516e14ee0444391006fc"
      },
      {
        "path": "assets/bakeoff/protagonist/glow-up/trial-b/frames/land-body-03.png",
        "sha256": "e88966db86795d80bf07184c0793eaada247a0eb78d97c247ead78edfd59e0db"
      },
      {
        "path": "assets/bakeoff/protagonist/glow-up/trial-b/frames/land-body-04.png",
        "sha256": "abe6332394362b3706edf40ae44f2881685c97d48420a1eecf9c55e2cf68a256"
      },
      {
        "path": "assets/bakeoff/protagonist/glow-up/trial-b/frames/land-body-05.png",
        "sha256": "30a4471f51a50d4184936dcc2fd543a64325a3df6732e9c8f52f5398005c7616"
      },
      {
        "path": "assets/bakeoff/protagonist/glow-up/trial-b/frames/land-scarf-00.png",
        "sha256": "7e4ece0287bfbb9f47f8d31c568ac54a9c2e40fede983369275d4492fcdd3e6b"
      },
      {
        "path": "assets/bakeoff/protagonist/glow-up/trial-b/frames/land-scarf-01.png",
        "sha256": "afbafd3473b2fbba4dd7c250e1fc07f5c72cb09db847b7740394608246bd0225"
      },
      {
        "path": "assets/bakeoff/protagonist/glow-up/trial-b/frames/land-scarf-02.png",
        "sha256": "b6f1da4cf5bd6dfa3dd38968f169d600059fa36653d20157d6d919d8b177fc8f"
      },
      {
        "path": "assets/bakeoff/protagonist/glow-up/trial-b/frames/land-scarf-03.png",
        "sha256": "8bcd05cc0f5a79f71ec9b2793f3a0aa206c35953a86e432f4a28ad1ac80cab58"
      },
      {
        "path": "assets/bakeoff/protagonist/glow-up/trial-b/frames/land-scarf-04.png",
        "sha256": "611cfe8cfca565e7e66a19efc2820ecd92143077ce2a90bc04a04b1597edc5ac"
      },
      {
        "path": "assets/bakeoff/protagonist/glow-up/trial-b/frames/land-scarf-05.png",
        "sha256": "1faa377e13446095d254048377f6d664a4a06c695824730da38b0adeb96aeb51"
      },
      {
        "path": "assets/bakeoff/protagonist/glow-up/scarf_attachments.json",
        "sha256": "595ebb24146248c0ed5ed710829638a36691abf813db7a43a1c39d0dd9eba28b"
      },
      {
        "path": "assets/bakeoff/protagonist/glow-up/apply_scarf_attachments.py",
        "sha256": "b465a5aec57d4adfcfb949b15a0fb72dd35eb8e22763edd487af69e621fed456"
      },
      {
        "path": "assets/bakeoff/protagonist/glow-up/trial-b/round9_lib.py",
        "sha256": "0b36837c090d1349debcc2580f5940a07ec1b16b643228f5938af7fbfa1380b7"
      }
    ]
  },
  "human_edits": [
    {
      "by": "VioletRound7 (Claude)",
      "description": "Commit be0abd4 (rounds.md round 7, land 3 to 6 frames): old frame 2 reindexed to 5 and new in-betweens 2, 3 and 4 finalized with finalize_anim.py --mode grounded.",
      "at": "2026-10-01T03:53:51+00:00"
    },
    {
      "by": "VioletRound9 (Claude)",
      "description": "Commit 679be37 (rounds.md round 9): round9_lib.py's scarf-only regen rewrote frames 3, 4 and 5's scarf_bbox_orig_1024canvas, scarf_final_size and scarf_offset_final.",
      "at": "2026-10-01T03:53:51+00:00"
    },
    {
      "by": "scarf-attachment correction (openai-codex/gpt-6-astra)",
      "description": "Commit dd40c07 ('Fix painted Violet scarf attachment', rounds.md 'Scarf attachment correction'): apply_scarf_attachments.py apply rewrote every frame's scarf_offset_final as body_neck - scarf_knot from scarf_attachments.json, replacing the crop-offset values; no placement field changed.",
      "at": "2026-10-01T03:53:51+00:00"
    }
  ],
  "license": "proprietary"
}
