{
  "schema_version": 1,
  "asset": "idle.gif",
  "sha256": "15fc91a3cf81a9fe5e6e236f38e7e2fc66ce5232349fb8f9a69b6f46e36d2ff0",
  "kind": "image",
  "origin": "derived",
  "created_at": "2026-09-30T14:09:22+00:00",
  "generator": {
    "tool": "shoot_b.py",
    "tool_version": "round-10; unchanged fixed layout",
    "model": null,
    "params": {},
    "inputs": [
      {
        "path": "assets/bakeoff/protagonist/glow-up/shoot_b.py",
        "sha256": "6a949541543d38f1957c20d4138361d20ace0dc746d60639689860d0405f4100"
      },
      {
        "path": "assets/bakeoff/protagonist/rig/violet.json",
        "sha256": "648eeca697454a59e529ce8ad68b198f125e777d11838cd3b3764d5090c41096"
      },
      {
        "path": "assets/bakeoff/protagonist/glow-up/trial-b/frames/idle-body-00.png",
        "sha256": "d09f920c9cad4226bb1dd09a27b6412a6628a1ee100d70088d5225ec163319ed"
      },
      {
        "path": "assets/bakeoff/protagonist/glow-up/trial-b/frames/idle-body-01.png",
        "sha256": "d1dc6951606687dfea6a9327d0eb005dd94e714e6463686b88cb2d58be062955"
      },
      {
        "path": "assets/bakeoff/protagonist/glow-up/trial-b/frames/idle-body-02.png",
        "sha256": "ac09ee211991d3abfcab5f66b7b3a85f046dd3ccc5a8938c85443510711f3e46"
      },
      {
        "path": "assets/bakeoff/protagonist/glow-up/trial-b/frames/idle-body-03.png",
        "sha256": "c2b13c52b6273078bc03122d012e3d17f788d46248635cb550c4fcda34c46863"
      },
      {
        "path": "assets/bakeoff/protagonist/glow-up/trial-b/frames/idle-body-04.png",
        "sha256": "92c24b4091e61e4748efd29c6109e4b5c1a723ca95269432354d4fef81b5561f"
      },
      {
        "path": "assets/bakeoff/protagonist/glow-up/trial-b/frames/idle-body-05.png",
        "sha256": "d501a18e3d0e7cf3357cf4c7376b01f75b5eb02fa05232daaf5f11df1ea08e79"
      },
      {
        "path": "assets/bakeoff/protagonist/glow-up/trial-b/frames/idle-body-06.png",
        "sha256": "5fcfc6a6926de1058c1ce841e0310e1b9225e9832df9ca109ac104b52f7e80e8"
      },
      {
        "path": "assets/bakeoff/protagonist/glow-up/trial-b/frames/idle-body-07.png",
        "sha256": "4213418c1a3a4350aa941ea96e2009f25811648807eb99ee869258220a09c936"
      },
      {
        "path": "assets/bakeoff/protagonist/glow-up/trial-b/frames/idle-scarf-00.png",
        "sha256": "518f7c76b99878986078dad6bcf32abcf17225b4d4af638a730fb9b5222eef93"
      },
      {
        "path": "assets/bakeoff/protagonist/glow-up/trial-b/frames/idle-scarf-01.png",
        "sha256": "82ae954a34b3c932fbebd298dbb6b8735b479ec96c8bc572db72d652a36ded27"
      },
      {
        "path": "assets/bakeoff/protagonist/glow-up/trial-b/frames/idle-scarf-02.png",
        "sha256": "870a9a2767c7937cb8e4cc9c3eb724342f7cc9bc21ad48d63fcfcaad6d6f4ef4"
      },
      {
        "path": "assets/bakeoff/protagonist/glow-up/trial-b/frames/idle-scarf-03.png",
        "sha256": "82ae954a34b3c932fbebd298dbb6b8735b479ec96c8bc572db72d652a36ded27"
      },
      {
        "path": "assets/bakeoff/protagonist/glow-up/trial-b/frames/idle-scarf-04.png",
        "sha256": "7fb2662507c561456c65c448d179f7bf1ff07629a01ee0df777219bb6d537f41"
      },
      {
        "path": "assets/bakeoff/protagonist/glow-up/trial-b/frames/idle-scarf-05.png",
        "sha256": "a5e1a948e6cea3106d5ac1824a828d29d1d5384b3dd31165ea0f0012206a2f36"
      },
      {
        "path": "assets/bakeoff/protagonist/glow-up/trial-b/frames/idle-scarf-06.png",
        "sha256": "ec77cf3b0b314c0d7f33dc2a8024a511fd8e4fcf4738ccb7f88c44224136d8a1"
      },
      {
        "path": "assets/bakeoff/protagonist/glow-up/trial-b/frames/idle-scarf-07.png",
        "sha256": "a5e1a948e6cea3106d5ac1824a828d29d1d5384b3dd31165ea0f0012206a2f36"
      }
    ]
  },
  "human_edits": [],
  "license": "proprietary"
}
