{
  "schema_version": 1,
  "asset": "fall.gif",
  "sha256": "00f8177cceca76a3434f3d1266ad5ece92e7dac3e35ac1a43b7c10f5d0c4f35d",
  "kind": "image",
  "origin": "derived",
  "created_at": "2026-09-30T17:42:24+00:00",
  "generator": {
    "tool": "shoot_b.py",
    "tool_version": "scarf-attachment-correction",
    "model": null,
    "params": {
      "placement_records_sha256": "{\"assets/bakeoff/protagonist/glow-up/trial-b/frames/dash-finalize-record.json\": \"9b5f991b5fe7a9e7e7a711c3edaa19ca3024595da3e5a9433703aaa73bcbacfc\", \"assets/bakeoff/protagonist/glow-up/trial-b/frames/double_jump-finalize-record.json\": \"4de87e5f40a178ace0d0bdc68dbb0e240af896c623353d0b570a85d79492d699\", \"assets/bakeoff/protagonist/glow-up/trial-b/frames/fall-finalize-record.json\": \"d0273f288442346bb623a620a80fd409fe4e34d83b8c3b7246b15cf411288f84\", \"assets/bakeoff/protagonist/glow-up/trial-b/frames/finalize-record.json\": \"d7e826974050513c95a4afa666f68c250e76b4b4d7e044d13877f319f1b5b880\", \"assets/bakeoff/protagonist/glow-up/trial-b/frames/idle-finalize-record.json\": \"13ca8d9f38c3afe8cf9745cb9e3dc9d0861d656b62abc22fa2a6b618d15a4c2f\", \"assets/bakeoff/protagonist/glow-up/trial-b/frames/jump-finalize-record.json\": \"bde3ccdb8fbea49d4886da84882ebfc2c6ef992d8e0ab8247b72d0192b705d01\", \"assets/bakeoff/protagonist/glow-up/trial-b/frames/land-finalize-record.json\": \"015c54aa1a94c1473060f38b0f445b0471bb94b15feb9b8fb088ecfd5f0c362b\"}",
      "body_placement_baseline": "9b254de2a19a4791c3aa7bc98e798db1563d307e; only scarf offsets changed"
    },
    "inputs": [
      {
        "path": "assets/bakeoff/protagonist/glow-up/shoot_b.py",
        "sha256": "466d3469510472ba329084449b1f2b4cb003a9600566baee78cd5f7470c3f420"
      },
      {
        "path": "assets/bakeoff/protagonist/glow-up/scarf_attachments.json",
        "sha256": "595ebb24146248c0ed5ed710829638a36691abf813db7a43a1c39d0dd9eba28b"
      },
      {
        "path": "assets/bakeoff/protagonist/glow-up/apply_scarf_attachments.py",
        "sha256": "b465a5aec57d4adfcfb949b15a0fb72dd35eb8e22763edd487af69e621fed456"
      },
      {
        "path": "assets/bakeoff/protagonist/rig/violet.json",
        "sha256": "648eeca697454a59e529ce8ad68b198f125e777d11838cd3b3764d5090c41096"
      },
      {
        "path": "assets/bakeoff/protagonist/glow-up/trial-b/frames/fall-body-00.png",
        "sha256": "8f6c4ad4004dcdadfcfb0601545c5d56923c9a198df605b0140ff0537ff413b8"
      },
      {
        "path": "assets/bakeoff/protagonist/glow-up/trial-b/frames/fall-body-01.png",
        "sha256": "b6b1cd6023f23ed9258b312c35c423e562f4fdef3ec870c583451ced4cfbc775"
      },
      {
        "path": "assets/bakeoff/protagonist/glow-up/trial-b/frames/fall-body-02.png",
        "sha256": "ec55ad630e81d9152f65150eac81e459e676dfacae3d3024592c2405dcfaecd7"
      },
      {
        "path": "assets/bakeoff/protagonist/glow-up/trial-b/frames/fall-body-03.png",
        "sha256": "b538d40eee95de708943f3e43eed7da8b38f40f17b43aaad49264bea088af137"
      },
      {
        "path": "assets/bakeoff/protagonist/glow-up/trial-b/frames/fall-body-04.png",
        "sha256": "c123a07b822b8fba0f0d7bf91ecbacaaefb08a816f58a70815441a05684b5e98"
      },
      {
        "path": "assets/bakeoff/protagonist/glow-up/trial-b/frames/fall-scarf-00.png",
        "sha256": "8a62a26001af47a4abb6ff9b78d940c4a5914f120313b868e9a872af22038761"
      },
      {
        "path": "assets/bakeoff/protagonist/glow-up/trial-b/frames/fall-scarf-01.png",
        "sha256": "db33d5b8b85624cf4bdbf3ff74be31473e34b49498533436f221cbb5a90db004"
      },
      {
        "path": "assets/bakeoff/protagonist/glow-up/trial-b/frames/fall-scarf-02.png",
        "sha256": "6d8be4fd8b1eccf2ef2570441efeff8516a64064184b1107d7aa121906b81ff6"
      },
      {
        "path": "assets/bakeoff/protagonist/glow-up/trial-b/frames/fall-scarf-03.png",
        "sha256": "9beabccb2b593c32b50805b561b31184431a05ada78debdfc4cfc701109ca3f3"
      },
      {
        "path": "assets/bakeoff/protagonist/glow-up/trial-b/frames/fall-scarf-04.png",
        "sha256": "7668c07b5f2fda34d745fd26ef45b905ce3efdce2bd53fb4124738d144cebf40"
      }
    ]
  },
  "human_edits": [],
  "license": "proprietary"
}
