{
  "schema_version": 1,
  "asset": "idle-body-04.round-07.png",
  "sha256": "dc50db1525d1197ec7b281a183c56f275cb6a8b45a44039e8b0a840514151d6b",
  "kind": "image",
  "origin": "derived",
  "created_at": "2026-09-30T02:56:21+00:00",
  "generator": {
    "tool": "assets/bakeoff/protagonist/glow-up/trial-b/grade_b.py",
    "tool_version": "grade_b.py round 5: darkens body value (scale(V)=1-BODY_K*(1-V/255), BODY_K=0.56, protecting near-white highlights/skin/face) with a soft warm rim a few px inside the alpha edge, and solidifies scarf alpha (morphological close + narrow Gaussian edge, SCARF_EDGE_PX=7) so only ~1-2 final px stay soft -- reads the frozen round-04.png copy",
    "model": null,
    "params": {},
    "inputs": [
      {
        "path": "assets/bakeoff/protagonist/glow-up/trial-b/frames/idle-body-04.round-04.png",
        "sha256": "578e1b17037f0201cb54393535a4db800c75c42b16a261d933a898451d31fe0b"
      }
    ]
  },
  "human_edits": [
    {
      "by": "VioletRound8 (Claude)",
      "description": "Frozen as idle-body-04.round-07.png for round 7's own shot provenance (identical bytes to the live idle-body-04.png through round 7, same generator metadata as the live file's own round-7 record since it's the same pixels/bytes, just parked at a path nothing will touch again) before glow-up round 8 overwrote the live idle-body-04.png with a procedural idle hybrid (idle_hybrid.py: one held body painting (idle-body-00) and one held scarf painting (idle-scarf-00), each animated by a deterministic warp -- a piecewise vertical breathing stretch above a fixed waist line for the body, a piecewise horizontal sway shear below a fixed neck pivot for the scarf -- instead of 8 separate from-scratch paintings, fixing round 7's kept gap 1, 'boiling'); see assets/bakeoff/protagonist/glow-up/rounds.md's 'Frozen inputs' convention.",
      "at": "2026-09-30T06:36:48+00:00"
    }
  ],
  "license": "proprietary"
}
