{
  "schema_version": 1,
  "asset": "idle-body-02.png",
  "sha256": "ac09ee211991d3abfcab5f66b7b3a85f046dd3ccc5a8938c85443510711f3e46",
  "kind": "image",
  "origin": "derived",
  "created_at": "2026-09-30T14:09:22+00:00",
  "generator": {
    "tool": "idle_hybrid.py",
    "tool_version": "round-10",
    "model": null,
    "params": {
      "frame": "2",
      "time": "0.25",
      "loop_seconds": "1"
    },
    "inputs": [
      {
        "path": "assets/bakeoff/protagonist/glow-up/trial-b/idle_hybrid.py",
        "sha256": "a48705f08a582367f2f30ee0d19679af03efbe81f59793eef7a41aa28055310f"
      },
      {
        "path": "assets/bakeoff/protagonist/glow-up/trial-b/frames/idle-body-00.round-07.png",
        "sha256": "135c86bc1999684e242b4737628526f493868c80dae2d8332a7b7fd81742c7c8"
      }
    ]
  },
  "human_edits": [],
  "license": "proprietary"
}
