{
  "schema_version": 1,
  "asset": "dash.gif",
  "sha256": "81f2c72f1f4664a26a52b943f87d9e7fc52029920e30d60aeabf60b691e07e6e",
  "kind": "image",
  "origin": "derived",
  "created_at": "2026-09-30T04:39:50+00:00",
  "generator": {
    "tool": "assets/bakeoff/protagonist/glow-up/shoot_b.py",
    "tool_version": "shoot_b.py round-06: technique B (run/idle torso-lock + head-rhythm placement offsets, idle scarf repaint, fall frame 4 repaint) in shoot.py's exact fixed layout",
    "model": null,
    "params": {
      "command": "uv run --project tools/spinerig python assets/bakeoff/protagonist/glow-up/shoot_b.py --rig assets/bakeoff/protagonist/rig/violet.json --out assets/bakeoff/protagonist/glow-up/round-06"
    },
    "inputs": [
      {
        "path": "assets/bakeoff/protagonist/glow-up/shoot_b.py",
        "sha256": "6a949541543d38f1957c20d4138361d20ace0dc746d60639689860d0405f4100"
      },
      {
        "path": "assets/bakeoff/protagonist/glow-up/trial-b/frames/dash-body-00.png",
        "sha256": "04f0bd3f49e1a853a2e3df7be36a6e11feb403cdb1309787ea96560756d5ee6d"
      },
      {
        "path": "assets/bakeoff/protagonist/glow-up/trial-b/frames/dash-scarf-00.png",
        "sha256": "026452145e3eac341c393433d32971590a5453d50940876ee7f1ca5b6937d9e8"
      },
      {
        "path": "assets/bakeoff/protagonist/glow-up/trial-b/frames/dash-body-01.round-06.png",
        "sha256": "6b177ff1ec904b4d8a03aea6f0e234dbb05e2fe09cd945718f632a11cb911108"
      },
      {
        "path": "assets/bakeoff/protagonist/glow-up/trial-b/frames/dash-scarf-01.round-06.png",
        "sha256": "8290de302c1dbac69fe305c3ea71b7ed93e0717773868f05aaed0838cde6567b"
      },
      {
        "path": "assets/bakeoff/protagonist/glow-up/trial-b/frames/dash-body-02.round-06.png",
        "sha256": "0fc46ce8baac21607714f340c5c96b4f86d43a7d4376ad12928cc43953e98b8f"
      },
      {
        "path": "assets/bakeoff/protagonist/glow-up/trial-b/frames/dash-scarf-02.round-06.png",
        "sha256": "5a2c59dee178199bf57970f7f3d18999eecbca6b84e0835f00bd2a4776494720"
      }
    ]
  },
  "human_edits": [
    {
      "by": "VioletRound7 (Claude)",
      "description": "Round 7 (rounds.md's 'Frozen inputs' convention): re-pointed the inputs that changed this round (double_jump's scarf-02/03 repaint, and dash's/land's frame additions moving dash-body/scarf-01/02 and land-body/scarf-02's pixels to new indices) at their frozen assets/bakeoff/protagonist/glow-up/trial-b/frames/*.round-06.png copies, since round 7 overwrote or moved the live files; every other input is unchanged.",
      "at": "2026-09-30T05:09:42.659924+00:00"
    }
  ],
  "license": "proprietary"
}
