{
  "schema_version": 1,
  "asset": "dash.gif",
  "sha256": "f355d596a1a1789f2518d82ee464f6b5c45f7ccea649d032c3ba1b7809d0396e",
  "kind": "image",
  "origin": "derived",
  "created_at": "2026-09-30T17:42:24+00:00",
  "generator": {
    "tool": "shoot_b.py",
    "tool_version": "scarf-attachment-correction",
    "model": null,
    "params": {
      "placement_records_sha256": "{\"assets/bakeoff/protagonist/glow-up/trial-b/frames/dash-finalize-record.json\": \"9b5f991b5fe7a9e7e7a711c3edaa19ca3024595da3e5a9433703aaa73bcbacfc\", \"assets/bakeoff/protagonist/glow-up/trial-b/frames/double_jump-finalize-record.json\": \"4de87e5f40a178ace0d0bdc68dbb0e240af896c623353d0b570a85d79492d699\", \"assets/bakeoff/protagonist/glow-up/trial-b/frames/fall-finalize-record.json\": \"d0273f288442346bb623a620a80fd409fe4e34d83b8c3b7246b15cf411288f84\", \"assets/bakeoff/protagonist/glow-up/trial-b/frames/finalize-record.json\": \"d7e826974050513c95a4afa666f68c250e76b4b4d7e044d13877f319f1b5b880\", \"assets/bakeoff/protagonist/glow-up/trial-b/frames/idle-finalize-record.json\": \"13ca8d9f38c3afe8cf9745cb9e3dc9d0861d656b62abc22fa2a6b618d15a4c2f\", \"assets/bakeoff/protagonist/glow-up/trial-b/frames/jump-finalize-record.json\": \"bde3ccdb8fbea49d4886da84882ebfc2c6ef992d8e0ab8247b72d0192b705d01\", \"assets/bakeoff/protagonist/glow-up/trial-b/frames/land-finalize-record.json\": \"015c54aa1a94c1473060f38b0f445b0471bb94b15feb9b8fb088ecfd5f0c362b\"}",
      "body_placement_baseline": "9b254de2a19a4791c3aa7bc98e798db1563d307e; only scarf offsets changed"
    },
    "inputs": [
      {
        "path": "assets/bakeoff/protagonist/glow-up/shoot_b.py",
        "sha256": "466d3469510472ba329084449b1f2b4cb003a9600566baee78cd5f7470c3f420"
      },
      {
        "path": "assets/bakeoff/protagonist/glow-up/scarf_attachments.json",
        "sha256": "595ebb24146248c0ed5ed710829638a36691abf813db7a43a1c39d0dd9eba28b"
      },
      {
        "path": "assets/bakeoff/protagonist/glow-up/apply_scarf_attachments.py",
        "sha256": "b465a5aec57d4adfcfb949b15a0fb72dd35eb8e22763edd487af69e621fed456"
      },
      {
        "path": "assets/bakeoff/protagonist/rig/violet.json",
        "sha256": "648eeca697454a59e529ce8ad68b198f125e777d11838cd3b3764d5090c41096"
      },
      {
        "path": "assets/bakeoff/protagonist/glow-up/trial-b/frames/dash-body-00.png",
        "sha256": "04f0bd3f49e1a853a2e3df7be36a6e11feb403cdb1309787ea96560756d5ee6d"
      },
      {
        "path": "assets/bakeoff/protagonist/glow-up/trial-b/frames/dash-body-01.png",
        "sha256": "590dacbd2ca4ed08f95556515769540af43dc6c190aaea0f34284f5739124ee9"
      },
      {
        "path": "assets/bakeoff/protagonist/glow-up/trial-b/frames/dash-body-02.png",
        "sha256": "6b177ff1ec904b4d8a03aea6f0e234dbb05e2fe09cd945718f632a11cb911108"
      },
      {
        "path": "assets/bakeoff/protagonist/glow-up/trial-b/frames/dash-body-03.png",
        "sha256": "a2f706838b808243725468bda206c99e5c10aa7884ce6525e34494339256359e"
      },
      {
        "path": "assets/bakeoff/protagonist/glow-up/trial-b/frames/dash-body-04.png",
        "sha256": "ef245a996c60b34de43a86def22ecfc8e5d11512699f8c9ae293899f1931ec6d"
      },
      {
        "path": "assets/bakeoff/protagonist/glow-up/trial-b/frames/dash-body-05.png",
        "sha256": "0fc46ce8baac21607714f340c5c96b4f86d43a7d4376ad12928cc43953e98b8f"
      },
      {
        "path": "assets/bakeoff/protagonist/glow-up/trial-b/frames/dash-scarf-00.png",
        "sha256": "7c93c14cc43437da9ca266bd31522c1b4974718965b11c5244fb1e048bb4ee2a"
      },
      {
        "path": "assets/bakeoff/protagonist/glow-up/trial-b/frames/dash-scarf-01.png",
        "sha256": "4be05ae0846fe637f58b71ab46da52576d8fd6d9584368fa174b16462d79c9f5"
      },
      {
        "path": "assets/bakeoff/protagonist/glow-up/trial-b/frames/dash-scarf-02.png",
        "sha256": "b7ae5bda5d7d6c3cce3eb1b6a807f9e0af2d67e4358bfca7af7c67549a6a39f8"
      },
      {
        "path": "assets/bakeoff/protagonist/glow-up/trial-b/frames/dash-scarf-03.png",
        "sha256": "3a6c5949d7a3ce900d51189943601c82ef4ddfd79d9deff70ab944250e3d285a"
      },
      {
        "path": "assets/bakeoff/protagonist/glow-up/trial-b/frames/dash-scarf-04.png",
        "sha256": "bdfeeb3cff6b178038ce5d6f476f7d0fb2659336df7fed3e17fbc1070b00112a"
      },
      {
        "path": "assets/bakeoff/protagonist/glow-up/trial-b/frames/dash-scarf-05.png",
        "sha256": "3b23412eff92f611337b444ba480da2c7e168763cdb506c452e92f2bf3fb3e6c"
      }
    ]
  },
  "human_edits": [],
  "license": "proprietary"
}
