{
  "schema_version": 1,
  "asset": "idle-scarf-01.round-09.png",
  "sha256": "82ae954a34b3c932fbebd298dbb6b8735b479ec96c8bc572db72d652a36ded27",
  "kind": "image",
  "origin": "derived",
  "created_at": "2026-09-30T06:37:24+00:00",
  "generator": {
    "tool": "assets/bakeoff/protagonist/glow-up/trial-b/idle_hybrid.py",
    "tool_version": "idle_hybrid.py round 8: idle frame 1/8 (t=0.125s of a 1.0s loop). Holds idle-scarf-00.round-07.png (round 6's own frame-0 scarf painting, paired with idle-body-00 at generation time) as the single source painting and applies a piecewise horizontal shear below a fixed pivot near the neck knot (alpha centroid of the topmost 15 rows; rows at/above the pivot are an exact identity copy) at angle=2.121 degrees (angle(t)=3*sin(2*pi*t), peak 3 degrees), so the tail drifts side to side like a hanging cloth while the knot stays anchored -- fixes round 7's kept gap 1 ('boiling': round-07/critic.md) without redrawing the scarf.",
    "model": null,
    "params": {},
    "inputs": [
      {
        "path": "assets/bakeoff/protagonist/glow-up/trial-b/frames/idle-scarf-00.round-07.png",
        "sha256": "594464eb09091fbe94dfd8e7e7eda6e19a0b54b9d1661252e918cf6a8424eae3"
      }
    ]
  },
  "human_edits": [],
  "license": "proprietary"
}
