{
  "schema_version": 1,
  "asset": "double_jump.gif",
  "sha256": "2b372be4fa57532ce1058b78e30e9d253e9b5d1cf33d0aa6bc7fbc8e5321f9d6",
  "kind": "image",
  "origin": "derived",
  "created_at": "2026-09-30T17:42:24+00:00",
  "generator": {
    "tool": "shoot_b.py",
    "tool_version": "scarf-attachment-correction",
    "model": null,
    "params": {
      "placement_records_sha256": "{\"assets/bakeoff/protagonist/glow-up/trial-b/frames/dash-finalize-record.json\": \"9b5f991b5fe7a9e7e7a711c3edaa19ca3024595da3e5a9433703aaa73bcbacfc\", \"assets/bakeoff/protagonist/glow-up/trial-b/frames/double_jump-finalize-record.json\": \"4de87e5f40a178ace0d0bdc68dbb0e240af896c623353d0b570a85d79492d699\", \"assets/bakeoff/protagonist/glow-up/trial-b/frames/fall-finalize-record.json\": \"d0273f288442346bb623a620a80fd409fe4e34d83b8c3b7246b15cf411288f84\", \"assets/bakeoff/protagonist/glow-up/trial-b/frames/finalize-record.json\": \"d7e826974050513c95a4afa666f68c250e76b4b4d7e044d13877f319f1b5b880\", \"assets/bakeoff/protagonist/glow-up/trial-b/frames/idle-finalize-record.json\": \"13ca8d9f38c3afe8cf9745cb9e3dc9d0861d656b62abc22fa2a6b618d15a4c2f\", \"assets/bakeoff/protagonist/glow-up/trial-b/frames/jump-finalize-record.json\": \"bde3ccdb8fbea49d4886da84882ebfc2c6ef992d8e0ab8247b72d0192b705d01\", \"assets/bakeoff/protagonist/glow-up/trial-b/frames/land-finalize-record.json\": \"015c54aa1a94c1473060f38b0f445b0471bb94b15feb9b8fb088ecfd5f0c362b\"}",
      "body_placement_baseline": "9b254de2a19a4791c3aa7bc98e798db1563d307e; only scarf offsets changed"
    },
    "inputs": [
      {
        "path": "assets/bakeoff/protagonist/glow-up/shoot_b.py",
        "sha256": "466d3469510472ba329084449b1f2b4cb003a9600566baee78cd5f7470c3f420"
      },
      {
        "path": "assets/bakeoff/protagonist/glow-up/scarf_attachments.json",
        "sha256": "595ebb24146248c0ed5ed710829638a36691abf813db7a43a1c39d0dd9eba28b"
      },
      {
        "path": "assets/bakeoff/protagonist/glow-up/apply_scarf_attachments.py",
        "sha256": "b465a5aec57d4adfcfb949b15a0fb72dd35eb8e22763edd487af69e621fed456"
      },
      {
        "path": "assets/bakeoff/protagonist/rig/violet.json",
        "sha256": "648eeca697454a59e529ce8ad68b198f125e777d11838cd3b3764d5090c41096"
      },
      {
        "path": "assets/bakeoff/protagonist/glow-up/trial-b/frames/double_jump-body-00.png",
        "sha256": "0cd48705d89d149fb768a1c790469485d249e62284c5b3b6bdf06e2b12d48d4c"
      },
      {
        "path": "assets/bakeoff/protagonist/glow-up/trial-b/frames/double_jump-body-01.png",
        "sha256": "f754dfbaf32414b82eeb845a5656b97b2fba6e423b32ff0a9690d14b3ca313c2"
      },
      {
        "path": "assets/bakeoff/protagonist/glow-up/trial-b/frames/double_jump-body-02.png",
        "sha256": "7c379878472cf0e1bf0814d8d63d7f710aec98ce26a7fe356142c17a66ab1017"
      },
      {
        "path": "assets/bakeoff/protagonist/glow-up/trial-b/frames/double_jump-body-03.png",
        "sha256": "0ccde770b78b83e84300a9459d3aff1e327a5b6889a10907d2ccf90ef1162cf5"
      },
      {
        "path": "assets/bakeoff/protagonist/glow-up/trial-b/frames/double_jump-body-04.png",
        "sha256": "52fedcb5c5775746248ca3e8eab55e96ec5d5ebd0a090ff760ea665efcde76d4"
      },
      {
        "path": "assets/bakeoff/protagonist/glow-up/trial-b/frames/double_jump-scarf-00.png",
        "sha256": "35fa2c3c13872d6fea32d08fa1417beee1b577df8160ed8315bd10c5ee2d66eb"
      },
      {
        "path": "assets/bakeoff/protagonist/glow-up/trial-b/frames/double_jump-scarf-01.png",
        "sha256": "f15d97e2b8bea8b538dd31ce692f2b6ab1c386e1f9265467e8c6edab6615bc3a"
      },
      {
        "path": "assets/bakeoff/protagonist/glow-up/trial-b/frames/double_jump-scarf-02.png",
        "sha256": "bc8f2e930e0efdc23fb12a8f4f23373f263c4a45887e3667bf7c88bed359b9cc"
      },
      {
        "path": "assets/bakeoff/protagonist/glow-up/trial-b/frames/double_jump-scarf-03.png",
        "sha256": "0e31a966f18a007fd1fdb996039f459e12bd2063a80623367686132962994cf7"
      },
      {
        "path": "assets/bakeoff/protagonist/glow-up/trial-b/frames/double_jump-scarf-04.png",
        "sha256": "d0c450d10a3e3e954c0d833cca05cc4a5347cb7e5f0c6e1aa865de46b17fd29c"
      }
    ]
  },
  "human_edits": [],
  "license": "proprietary"
}
